Source,Date,Text,URL,Favorites,Retweets,Replies
La Nacion,2016-05-01 16:45:11,"Ricardo Darín: ""Me preparo para la gran crisis de los 60"" https://t.co/POoqYJXICk Por @VictorGhitta https://t.co/tqCvbI4i9R",http://www.twitter.com/LANACION/status/726814734947864577,96,26,18
La Nacion,2016-05-01 16:31:11,Yiya Murano: del mito de envenenar con masas a ser la autora de más crímenes https://t.co/gNqMT0zP8R https://t.co/mz1sSnk9Mr,http://www.twitter.com/LANACION/status/726811214911787009,38,15,2
La Nacion,2016-05-01 16:17:10,"De qué se trata Outcast, la nueva serie del creador de The Walking Dead https://t.co/rNokVRIj6I https://t.co/ZKy4FJB7AZ",http://www.twitter.com/LANACION/status/726807685937696770,27,10,0
La Nacion,2016-05-01 16:03:10,.@CandeTinelli se hizo otro tatuaje y despertó enojo en las redes https://t.co/RkKGpVZgRM https://t.co/DZW9wp0ZCy,http://www.twitter.com/LANACION/status/726804162927837184,20,8,18
La Nacion,2016-05-01 15:49:11,La corona británica difundió las primeras imágenes de la princesa Charlotte https://t.co/TbR1OYY8kY https://t.co/bv0wP60Lel,http://www.twitter.com/LANACION/status/726800643646722049,124,24,10
La Nacion,2016-05-01 15:35:10,El colorido y letal desierto donde los científicos buscan los extremos de la vida https://t.co/sZPqsTieHd https://t.co/ceYYHUD1ci,http://www.twitter.com/LANACION/status/726797117654749184,40,28,0
La Nacion,2016-05-01 15:21:12,¡Diosa! Mirá el nuevo look de @GimeAccardi https://t.co/yC5A34dEbr https://t.co/dLqDR4GTBA,http://www.twitter.com/LANACION/status/726793599753588736,32,2,2
La Nacion,2016-05-01 15:07:11,.@MauricioMacri se muestra con Luis Barrionuevo en el Día del Trabajador https://t.co/HxzmpBzYpB https://t.co/1jozdpTTmZ,http://www.twitter.com/LANACION/status/726790072574590976,148,67,20
La Nacion,2016-05-01 14:53:09,"10 canciones emblemáticas que exaltan, denuncian o repudian el trabajo https://t.co/nFC9dbqroe https://t.co/Xf59IF4VfX",http://www.twitter.com/LANACION/status/726786544221196288,18,22,2
La Nacion,2016-05-01 14:39:10,Francisco pidió castigar severamente a los abusadores de menores https://t.co/Ybmz90tXsd https://t.co/WhoBFGZR8q,http://www.twitter.com/LANACION/status/726783022842929156,134,49,11
La Nacion,2016-05-01 14:25:09,Marijuan dijo no se puede asegurar que el espacio hallado en la casa de Báez era una bóveda https://t.co/mJxi6eP3Li https://t.co/QOs8R1KX9S,http://www.twitter.com/LANACION/status/726779498369273856,32,36,20
La Nacion,2016-05-01 14:11:11,"Luisana Lopilato y Michael Bublé, en familia en el Teatro Colón https://t.co/7m3sm19LTz https://t.co/fHMEVnTUXS",http://www.twitter.com/LANACION/status/726775983244742656,71,12,1
La Nacion,2016-05-01 13:57:10,Pronostico del tiempo: ¿hasta cuándo seguirá el frío? https://t.co/fMGjtiDllI https://t.co/u0ION9dHaC,http://www.twitter.com/LANACION/status/726772453008130049,18,9,13
La Nacion,2016-05-01 13:43:10,"Hugo Moyano: ""Están sincerando la economía de una forma muy brutal"" https://t.co/gI2NtLuvuI https://t.co/LJAjlaPDvS",http://www.twitter.com/LANACION/status/726768929457229824,24,16,20
La Nacion,2016-05-01 13:27:09,"Detuvieron en Salta al ex juez Reynoso, acusado de beneficiar a narcos https://t.co/ECJb6eNGND https://t.co/RbvFez10TL",http://www.twitter.com/LANACION/status/726764902132682753,71,41,3
La Nacion,2016-05-01 13:10:11,"Dybala no le teme a la comparación con Messi: ""Es hora de ganar el Balón de Oro"" https://t.co/ENl0utu15Z https://t.co/8qXptCqU2s",http://www.twitter.com/LANACION/status/726760631014154240,26,8,10
La Nacion,2016-05-01 12:51:34,Leicester sueña en grande en Old Trafford y busca el título ante Manchester United https://t.co/PAyMTn4GRC https://t.co/JCFR7MNw7r,http://www.twitter.com/LANACION/status/726755945972379648,30,16,0
La Nacion,2016-05-01 12:37:35,"Ricardo Darín: ""Me preparo para la gran crisis de los 60"" https://t.co/DNESugNGW6 Por @VictorGhitta https://t.co/rEODDD5bmr",http://www.twitter.com/LANACION/status/726752426154463232,85,28,13
La Nacion,2016-05-01 12:21:35,Juventus festeja el título en Italia con un triunfo ante Carpi https://t.co/gs0pkeEMOg https://t.co/lQl80e9IJ3,http://www.twitter.com/LANACION/status/726748399882670081,13,8,0
La Nacion,2016-05-01 12:07:34,"Con una mezcla de espiritualidad e Inteligencia Artificial, un robot monje cautiva a China https://t.co/Jeh0xTdJXi https://t.co/ppMwYCIzRD",http://www.twitter.com/LANACION/status/726744872997277697,33,17,1
La Nacion,2016-05-01 11:53:35,"El ciudadano cumple 75 años como ""la mejor película de la historia"" https://t.co/xiXslPgaFG https://t.co/JLsGP8wH4o",http://www.twitter.com/LANACION/status/726741351472218112,55,51,3
La Nacion,2016-05-01 11:39:34,"Barros Schelotto: ""Las lesiones están complicando, pero tendremos que hacernos fuertes y ... https://t.co/vjuBA9MC4T https://t.co/nGHwgjgaLG",http://www.twitter.com/LANACION/status/726737827032109061,17,6,1
La Nacion,2016-05-01 11:25:35,Qué hacer en cada momento del día para sentirte mejor físicamente https://t.co/nuvVp8P5F1 https://t.co/qFcodn8Yxp,http://www.twitter.com/LANACION/status/726734305603522560,43,15,0
La Nacion,2016-05-01 11:08:35,Los puntajes de River: varios aplazos y un debutante que se llevó todos los aplausos https://t.co/p6A5tvQc1f https://t.co/sXwvjtBT0m,http://www.twitter.com/LANACION/status/726730027866415104,16,7,4
La Nacion,2016-05-01 10:54:34,Los puntajes de River: varios aplazos y un debutante que se llevó todos los aplausos https://t.co/HYvuGzSQRA https://t.co/GPd6XwkUul,http://www.twitter.com/LANACION/status/726726501719236608,13,0,1
La Nacion,2016-05-01 10:40:35,El desafío: Schwartzman busca su primer título ATP frente a Dimitrov https://t.co/72RghLir4Q https://t.co/QHxIKl7aFb,http://www.twitter.com/LANACION/status/726722984271040512,18,1,1
La Nacion,2016-05-01 10:24:34,"¿Desastre o acierto? El look ""leopardo dorado"" de Sharon Stone https://t.co/8BBZDLgJWB https://t.co/8sqGKv8i3g",http://www.twitter.com/LANACION/status/726718953628831744,36,1,10
La Nacion,2016-05-01 10:06:35,"Qué es Snaptrends, el controversial software que vigila a estudiantes de EE.UU. en redes ... https://t.co/0iakSmrdn1 https://t.co/vkDMWvYE7I",http://www.twitter.com/LANACION/status/726714426963927044,9,11,0
La Nacion,2016-05-01 09:49:35,Paliza de San Antonio en el comienzo de la semifinal del Oeste: Manu se lució con un pase... https://t.co/B581sBAgLS https://t.co/vPo2AoJYLV,http://www.twitter.com/LANACION/status/726710147259727872,10,9,0
La Nacion,2016-05-01 09:35:36,El cambio de actitud de los Jaguares propicia el despegue esperado https://t.co/OQ9WOfEloG https://t.co/A9FnOw0X4Z,http://www.twitter.com/LANACION/status/726706627152367618,11,9,0
La Nacion,2016-05-01 09:35:36,El cambio de actitud de los Jaguares propicia el despegue esperado https://t.co/OQ9WOfEloG https://t.co/A9FnOw0X4Z,http://www.twitter.com/LANACION/status/726706627152367618,11,9,0
La Nacion,2016-05-01 09:21:35,El cambio de actitud de los Jaguares propicia el despegue esperado https://t.co/Tgv9LNPAcT https://t.co/Suke6FayQa,http://www.twitter.com/LANACION/status/726703101391032321,18,7,0
La Nacion,2016-05-01 09:07:34,"De qué se trata Outcast, la nueva serie del creador de The Walking Dead https://t.co/DFCLychblJ https://t.co/grG590HNhF",http://www.twitter.com/LANACION/status/726699573469655040,27,9,0
La Nacion,2016-05-01 08:53:34,El mundo después de La broma infinita https://t.co/pkpBv0DEC6 https://t.co/8veHjrc2xT,http://www.twitter.com/LANACION/status/726696050631839744,7,4,0
La Nacion,2016-05-01 08:42:36,Sigue el plan de lucha de los universitarios https://t.co/7Yywht9ZrJ,http://www.twitter.com/LANACION/status/726693289789931520,10,9,4
La Nacion,2016-05-01 08:31:34,Platita dulce https://t.co/geOtZ3N8au,http://www.twitter.com/LANACION/status/726690514435710977,1,6,0
La Nacion,2016-05-01 08:19:34,Zenda o el infinito placer de la lectura https://t.co/WY7ifA7trL,http://www.twitter.com/LANACION/status/726687493509287936,6,1,0
La Nacion,2016-05-01 08:08:34,Una experiencia bajo la lupa de otros países europeos https://t.co/9Xg2APpxTR,http://www.twitter.com/LANACION/status/726684726384287744,2,3,7
La Nacion,2016-05-01 07:56:34,"El regreso de Marcos Di Palma, un atractivo para los 500 km de Olavarría https://t.co/fWyCjg4IRX https://t.co/KgAcMMKGk9",http://www.twitter.com/LANACION/status/726681705386483712,42,13,5
La Nacion,2016-05-01 07:44:35,Lewis Hamilton ratificó su ventaja sobre Nico Rosberg y va por la pole en Sochi https://t.co/l4Fmr3PRZw https://t.co/lh7Nb7V5wj,http://www.twitter.com/LANACION/status/726678689849692160,6,2,1
La Nacion,2016-05-01 07:32:34,"El CASI ganó y sigue como único invicto, pero esta vez le costó más de la cuenta https://t.co/QUXUAEexZy https://t.co/N9JOw0A2VH",http://www.twitter.com/LANACION/status/726675666150789120,10,3,0
La Nacion,2016-05-01 07:20:36,Martín Carrera: el lechoncito del río https://t.co/H7hukOoX0a https://t.co/hRHUGHhC3l,http://www.twitter.com/LANACION/status/726672656209170432,21,3,0
La Nacion,2016-05-01 07:09:34,"James Suckling: ""Cada vez hay más vinos perfectos"" https://t.co/n5lc3ictCL https://t.co/PdHOhMM4Cn",http://www.twitter.com/LANACION/status/726669879496065024,10,3,1
La Nacion,2016-05-01 06:56:35,Diego Schwartzman venció a Federico Delbonis y alcanzó la primera final ATP de su carrera... https://t.co/288hmsTYFL https://t.co/vs5bb3oFQn,http://www.twitter.com/LANACION/status/726666609725702144,27,1,0
La Nacion,2016-05-01 06:44:35,A la espera: las economías regionales aún no repuntan https://t.co/HwUMqYl3vZ https://t.co/fJznrTbxrn,http://www.twitter.com/LANACION/status/726663589818408960,13,10,1
La Nacion,2016-05-01 06:36:40,"Ley antidespidos, tarifazo y pobreza https://t.co/tR5Af452e2",http://www.twitter.com/LANACION/status/726661599294050304,13,9,5
La Nacion,2016-05-01 06:25:34,"La izquierda respalda a Dilma, pero exige un cambio de rumbo https://t.co/rsoAFkPOfc https://t.co/KN20Yj3yuo",http://www.twitter.com/LANACION/status/726658806118227968,14,7,3
La Nacion,2016-05-01 06:13:36,"Los superhéroes de Marvel, por primera vez frente a frente https://t.co/R2MXfbC3RB https://t.co/Xcde6EFJSP",http://www.twitter.com/LANACION/status/726655795425890304,31,15,0
La Nacion,2016-05-01 06:05:35,"Argentinos-Boca: con suplentes, los xeneizes visitan a un equipo necesitado https://t.co/SyClPO0NdO https://t.co/PIRDcBfoJg",http://www.twitter.com/LANACION/status/726653775667191808,12,4,1
La Nacion,2016-05-01 05:53:35,"Ecuador: según el presidente Rafael Correa, el FMI ofreció “400 millones sin condicionami... https://t.co/KQhkeOmJQt https://t.co/NwrbQvsKCz",http://www.twitter.com/LANACION/status/726650755105603588,14,14,1
La Nacion,2016-05-01 05:41:34,Real Sociedad-Real Madrid: el equipo de Zidane busca seguir a tiro de la liga https://t.co/x22SqygRuG https://t.co/z7V0QXru7g,http://www.twitter.com/LANACION/status/726647734380421120,3,1,1
La Nacion,2016-05-01 05:27:33,"""Hago un inventario y tiro lo que no utilicé en los últimos 6 meses"" https://t.co/Lwr1MIPe83",http://www.twitter.com/LANACION/status/726644206664617985,22,12,1
La Nacion,2016-05-01 05:14:35,Dos días para celebrar la parrilla https://t.co/jQLjgJh6iU,http://www.twitter.com/LANACION/status/726640941004689408,14,2,1
La Nacion,2016-05-01 05:02:36,Andrea Grobocopatel: “Este año va a haber mucho lugar para el emprendedorismo” https://t.co/OgPqCZPIb5 https://t.co/msVgjgJtfn,http://www.twitter.com/LANACION/status/726637924616429568,45,31,15
La Nacion,2016-05-01 04:55:35,Podemos pone en marcha un plan para superar al socialismo español https://t.co/Ysa4knyNcz https://t.co/fAfc8R73sZ,http://www.twitter.com/LANACION/status/726636159464542209,17,9,9
La Nacion,2016-05-01 04:42:34,"Jorge Capitanich lamentó que muchos trabajadores pasarán su día ""con la angustia de haber... https://t.co/Zn1BGpLNDb https://t.co/oKU3ML7kZf",http://www.twitter.com/LANACION/status/726632883486601216,24,11,20
La Nacion,2016-05-01 04:30:37,Time Warp: Horacio Rodríguez Larreta remarcó que la Ciudad está “a disposición de la ... https://t.co/RN8SIiTkbK https://t.co/ViDNQVdPiu,http://www.twitter.com/LANACION/status/726629878196502529,20,17,13
La Nacion,2016-05-01 04:24:35,Yiya Murano: del mito de envenenar con masas a ser la autora de más crímenes https://t.co/itMj5sf1sG https://t.co/85cQn6ZGdZ,http://www.twitter.com/LANACION/status/726628357467688960,16,13,1
La Nacion,2016-05-01 04:12:41,La pregunta es cómo hacer un mundo mejor... sin volverlo peor https://t.co/EDahTPAwMZ,http://www.twitter.com/LANACION/status/726625364643057665,20,13,8
La Nacion,2016-05-01 04:00:30,Ecuador: aún buscan a diez argentinos desaparecidos tras el terremoto https://t.co/GcvUujEZVS https://t.co/wf2VXgUvWa,http://www.twitter.com/LANACION/status/726622299475025920,35,48,0
La Nacion,2016-05-01 03:48:26,"Así rompió en llanto Tomás Andrade, uno de los juveniles que debutó en la Primera de River https://t.co/CAt7ZKNMHS https://t.co/6EMU3v3Mlv",http://www.twitter.com/LANACION/status/726619261104472068,105,34,7
La Nacion,2016-05-01 03:36:26,Cuba derrotó 22-10 a Duendes y se metió en los cuartos de final https://t.co/H5oWHzDnV5 https://t.co/XUrGZghMyH,http://www.twitter.com/LANACION/status/726616240916172802,14,7,1
La Nacion,2016-05-01 03:30:27,Ida y vuelta https://t.co/2KitxnHgqh,http://www.twitter.com/LANACION/status/726614735030988800,5,4,1
La Nacion,2016-05-01 03:24:27,Defensa y Justicia-San Martín de San Juan: los de Varela necesitan volver a creer https://t.co/2keJkmQ0AM https://t.co/5dD9K1jmx6,http://www.twitter.com/LANACION/status/726613223814926336,7,1,0
La Nacion,2016-05-01 03:12:30,El desafío de desaprender: la necesidad de seguir actualizando nuestro saber a lo largo ... https://t.co/j9iZHOIyLI https://t.co/FpYttBKNMN,http://www.twitter.com/LANACION/status/726610218063433732,77,59,2
La Nacion,2016-05-01 03:01:27,Mirá el resumen de noticias de la semana https://t.co/Td44m0ctQa https://t.co/vPk2IoeuaR,http://www.twitter.com/LANACION/status/726607435532754944,21,7,1
La Nacion,2016-05-01 02:50:27,Jaguares-Kings: la franquicia argentina quiere dejar atrás las siete derrotas consecutiva... https://t.co/dT7SrjO9K7 https://t.co/T0NxybjVAH,http://www.twitter.com/LANACION/status/726604668122611712,19,8,2
La Nacion,2016-05-01 02:45:27,".@DanielScioli dijo que ""los resultados del Gobierno son pobres"" y @MariuVidal lo cruzó https://t.co/molnExRUNE https://t.co/4hjTeLrps4",http://www.twitter.com/LANACION/status/726603410573807616,116,81,20
La Nacion,2016-05-01 02:38:26,Nicolás Lodeiro se rompió el menisco externo y el lunes será operado https://t.co/U9bxuGRraq https://t.co/owkiZLgcwa,http://www.twitter.com/LANACION/status/726601645308690432,27,13,11
La Nacion,2016-05-01 02:30:26,"Jazz y pintura, el homenaje a Ernesto Sabato a cinco años de su muerte https://t.co/N7SinQx1xU https://t.co/vUtgux9nO5",http://www.twitter.com/LANACION/status/726599632994897920,70,21,4
La Nacion,2016-05-01 02:24:29,Entre tablas https://t.co/YOAcmqguK4 https://t.co/OiMIV715Hx,http://www.twitter.com/LANACION/status/726598133321445376,19,7,0
La Nacion,2016-05-01 02:13:32,Habló Cristina Kirchner después de la marcha sindical https://t.co/CwP65Wue4L https://t.co/aBpfuHrzGx,http://www.twitter.com/LANACION/status/726595378909425664,22,13,19
La Nacion,2016-05-01 02:01:29,¿Desastre o acierto? El rotundo cambio de look de Justin Bieber https://t.co/YZ6kZ5H63A https://t.co/3MHNHsCOYn,http://www.twitter.com/LANACION/status/726592348549988352,20,7,9
La Nacion,2016-05-01 01:54:27,El final de la Liga de España: el fixture de las últimas dos fechas y cómo se define en ... https://t.co/Pnhmiapj0L https://t.co/9Fzz7Ebkq4,http://www.twitter.com/LANACION/status/726590574606864385,8,7,0
La Nacion,2016-05-01 01:42:26,El fiscal dijo que “había olor a dinero” en las valijas secuestradas en la casa de Sala https://t.co/Y2bPWE2rqj https://t.co/tmsH68buEB,http://www.twitter.com/LANACION/status/726587550706577409,50,41,19
La Nacion,2016-05-01 01:30:33,"¡Cuidado, dormilones! El poco amistoso ""despertador"" de Arnold Schwarzenegger https://t.co/2Oi44rDkS4 https://t.co/zcwTCJY1ad",http://www.twitter.com/LANACION/status/726584562990592000,28,15,1
La Nacion,2016-05-01 01:18:27,Atlético Madrid-Rayo Vallecano: el Cholo Simeone sueña con pelear hasta el final https://t.co/RKRfMbegRE https://t.co/SVaJ019VXh,http://www.twitter.com/LANACION/status/726581515270889472,17,4,1
La Nacion,2016-05-01 01:07:27,Frigerio dijo que el Gobierno podría vetar la ley antidespidos https://t.co/4iH7wzp7TM https://t.co/TcJivCXJn1,http://www.twitter.com/LANACION/status/726578746627637248,84,44,14
La Nacion,2016-05-01 00:56:27,"Germán Garavano: ""Gils Carbó bajó el perfil, pero igual debe dar un paso al costado"" https://t.co/xVhPKvA0Jt https://t.co/9ccDCdR21S",http://www.twitter.com/LANACION/status/726575979343269888,116,115,18
La Nacion,2016-05-01 00:45:26,Una noche palermitana a pura cumbia https://t.co/RJ2tazGg2O https://t.co/YzFwSaKGZj,http://www.twitter.com/LANACION/status/726573208439263233,12,4,1
La Nacion,2016-05-01 00:33:26,Encontraron un espacio oculto en una estancia de Lázaro Báez e investigan si se trata de ... https://t.co/TMDWyp1ALT https://t.co/S1EW3wlQg6,http://www.twitter.com/LANACION/status/726570187827322881,64,59,10
La Nacion,2016-05-01 00:26:26,Rosario: crónica de una fiesta electrónica con mayores controles que terminó mal https://t.co/kvgmQP8mQu https://t.co/Qc1tFJZpYM,http://www.twitter.com/LANACION/status/726568425749884928,22,40,7
La Nacion,2016-05-01 00:15:26,¿Por qué algunas personas conservan su aspecto juvenil más que otras? https://t.co/rEKGuPqVoc https://t.co/xou5XucxPb,http://www.twitter.com/LANACION/status/726565656292921344,43,24,6
La Nacion,2016-05-01 00:02:27,"Las barras porteñas, un imán para los solitarios https://t.co/BVDgXJILL8 https://t.co/1Wuw8WW1SH",http://www.twitter.com/LANACION/status/726562389194317825,62,18,4
La Nacion,2016-04-30 23:51:27,"Sebastián Casanello dijo tener ""muchas expectativas"" en la investigación por lavado de ... https://t.co/03cXxalYpk https://t.co/9azr5JGOZl",http://www.twitter.com/LANACION/status/726559621977137152,40,39,17
La Nacion,2016-04-30 23:39:26,"Betis-Barcelona: Messi, con la obligación de ganar para mantener la diferencia https://t.co/HR4uXV885u https://t.co/GHQy7OExSP",http://www.twitter.com/LANACION/status/726556597942685696,3,1,0
La Nacion,2016-04-30 23:27:26,Independiente-San Lorenzo: duelo de candidatos en Avellaneda https://t.co/UNlCTs9PpS https://t.co/97SDuSZ6gD,http://www.twitter.com/LANACION/status/726553580304486400,4,4,1
La Nacion,2016-04-30 23:15:26,Argentinos-Boca: los xeneizes visitan al Bicho necesitado en La Paternal https://t.co/AesNEybGii https://t.co/H7dX4whab9,http://www.twitter.com/LANACION/status/726550560602771464,18,5,2
La Nacion,2016-04-30 23:04:30,"Luis Barrionuevo: ""No hay ninguna posibilidad de un paro general"" https://t.co/P3uooolWiV https://t.co/9w6yfk2KVB",http://www.twitter.com/LANACION/status/726547806937337856,109,67,17
La Nacion,2016-04-30 23:00:27,"""Que se quede intranquilo Moyano, porque Lilita va a seguir investigando la corrupción ... https://t.co/pHW1OUe0CV https://t.co/nNAI6W0H5W",http://www.twitter.com/LANACION/status/726546787247525888,429,350,19
La Nacion,2016-04-30 22:49:46,"Barack Obama: ""Desde ahora apreciaré el tango como un observador más que como un bailarín"" https://t.co/ObERZ1sohY https://t.co/ukxuKPo6sI",http://www.twitter.com/LANACION/status/726544098266636288,62,13,2
La Nacion,2016-04-30 22:49:26,Alemania: disturbios y cientos de detenidos en una protesta ante el Congreso Nacional del... https://t.co/wifws51IUW https://t.co/uIeaGYzykp,http://www.twitter.com/LANACION/status/726544015198396416,14,31,9
La Nacion,2016-04-30 22:37:26,"Huracán-Racing: el Globo y la Academia, frente a frente en Parque Patricios https://t.co/YFIOPwNlyC https://t.co/wmvabGQMkN",http://www.twitter.com/LANACION/status/726540996687831041,5,3,0
La Nacion,2016-04-30 22:25:27,"Amor de perros, la historia de dos animales que conmueve a San Juan https://t.co/G4x6JTaqT0 https://t.co/iSvszCkUru",http://www.twitter.com/LANACION/status/726537978542170112,119,66,3
La Nacion,2016-04-30 22:13:26,Nexos con offshores de familiares de De Andreis https://t.co/xRGQW3EAYx https://t.co/FxZEcjqfLI,http://www.twitter.com/LANACION/status/726534953966665728,24,44,20
La Nacion,2016-04-30 22:00:27,Impuntuales: ¿víctimas del reloj o desidia? https://t.co/LDAf2Jn9sp https://t.co/xsDvnDeqak,http://www.twitter.com/LANACION/status/726531689913171968,13,16,6
La Nacion,2016-04-30 21:46:27,¿Por qué dormimos peor en una cama que no es la nuestra? https://t.co/whgDGtxoag https://t.co/qH4fsUqH4k,http://www.twitter.com/LANACION/status/726528166811062276,24,11,2
La Nacion,2016-04-30 21:32:26,¿Qué dijo Jorge Rial sobre su separación de Agustina Kämpfer? https://t.co/Yem3NEKaFQ https://t.co/c7NeLRMhrh,http://www.twitter.com/LANACION/status/726524638323478528,12,6,19
La Nacion,2016-04-30 21:18:26,El increíble gol que se perdió Lucho González debajo del arco https://t.co/TJOHnnEjVV https://t.co/qy7COFMW4W,http://www.twitter.com/LANACION/status/726521114441224196,14,2,3
La Nacion,2016-04-30 21:04:27,"Bailando por un sueño 2016: sale Iliana Calabró, entra Favio Posca https://t.co/gCMGHO8gNu https://t.co/LfFe6C6GTh",http://www.twitter.com/LANACION/status/726517595348832257,23,7,9
La Nacion,2016-04-30 20:50:43,Tenía pedido de captura por homicidio y lo balearon en la cabeza https://t.co/d2mLTRDPFh,http://www.twitter.com/LANACION/status/726514139288449026,12,5,2
La Nacion,2016-04-30 20:47:31,"La extraña piedra esférica de Bosnia que ""podría ser la clave de una civilización perdida"" https://t.co/UvedNizJ1i https://t.co/8sYmYKAOtJ",http://www.twitter.com/LANACION/status/726513333118074881,66,39,7
La Nacion,2016-04-30 20:33:30,Bariloche plantará un árbol por cada chico que nace en la ciudad https://t.co/eXNjBOBoIu https://t.co/W4EdJH9xLA,http://www.twitter.com/LANACION/status/726509806287261696,338,177,7
La Nacion,2016-04-30 20:19:20,El Gobierno quiere poner Wi-Fi en las plazas de 1000 pueblos https://t.co/5WIhAODtyy https://t.co/dJBLj0L62k,http://www.twitter.com/LANACION/status/726506240847831042,170,75,16
La Nacion,2016-04-30 20:05:59,"¡Escrachados del mundo, unámonos! https://t.co/nwFWllzP9e https://t.co/0UW1nodU3M",http://www.twitter.com/LANACION/status/726502883814989824,71,49,20
La Nacion,2016-04-30 19:52:00,La ruta del stand up en Buenos Aires https://t.co/6Mji5BuSq3 https://t.co/yVt1HuCiCa,http://www.twitter.com/LANACION/status/726499361434259456,22,5,8
La Nacion,2016-04-30 19:38:44,¿Desastre o acierto? El rotundo cambio de look de Justin Bieber https://t.co/9qFnKythM9 https://t.co/G9SPCLr4Kl,http://www.twitter.com/LANACION/status/726496024043376640,15,3,4
La Nacion,2016-04-30 19:24:45,"Luciana Báez, la heredera inesperada https://t.co/GpVCLBGysM https://t.co/YIo6gh6Mdq",http://www.twitter.com/LANACION/status/726492503965372416,25,47,8
La Nacion,2016-04-30 19:10:45,Se acostó con un oso de 700 kilos pero algo no salió bien https://t.co/HFWWcWuhTa https://t.co/vH54wCdbrA,http://www.twitter.com/LANACION/status/726488982498975744,23,9,4
La Nacion,2016-04-30 18:56:44,Aumentan los cigarrillos https://t.co/XersPDiq4q https://t.co/KD7B5Hb7Ns,http://www.twitter.com/LANACION/status/726485454011437062,35,15,6
La Nacion,2016-04-30 18:42:45,El puente que se construyó al revés en Chile y ahora será demolido https://t.co/dN4HKL2RV4 https://t.co/z7W02XbI5s,http://www.twitter.com/LANACION/status/726481934415761408,22,23,8
La Nacion,2016-04-30 18:28:45,Allanaron un departamento de Lázaro Báez en Mar del Plata https://t.co/jqMUAkhVAn https://t.co/z3v2nMC7Yc,http://www.twitter.com/LANACION/status/726478411070214144,74,68,10
La Nacion,2016-04-30 18:14:45,"A lo Messi: Wanchope Abila le cumplió el sueño a ""Gustavito"" https://t.co/pQRzmDfjQG https://t.co/Ky6qfGz1un",http://www.twitter.com/LANACION/status/726474888777728002,49,26,1
La Nacion,2016-04-30 18:00:46,Otra mala para Boca https://t.co/GTTtPuLrmy https://t.co/pW9GqivNX0,http://www.twitter.com/LANACION/status/726471368905207808,25,13,1
La Nacion,2016-04-30 17:56:45,Habló Cristina Kirchner después de la marcha sindical https://t.co/MQW9m6NX4Q https://t.co/dT3gwEuVXn,http://www.twitter.com/LANACION/status/726470359076208640,24,15,19
La Nacion,2016-04-30 17:45:45,¡Ocho más! El curioso método de entrenamiento de Dolores Fonzi https://t.co/qhiDwe3ZmK https://t.co/icnK7Q3vl1,http://www.twitter.com/LANACION/status/726467589694734337,18,4,1
La Nacion,2016-04-30 17:31:46,Mañana la nafta aumenta 10% y la súper superará los $ 17 https://t.co/5wlcCeJNQZ https://t.co/WK7rEWzWDx,http://www.twitter.com/LANACION/status/726464070170361856,21,45,20
La Nacion,2016-04-30 17:18:44,Una comadreja provocó un cortocircuito y paralizó la Máquina de Dios https://t.co/yEdOpEaWUB https://t.co/SvavCUNfvz,http://www.twitter.com/LANACION/status/726460793018015744,58,27,12
La Nacion,2016-04-30 17:04:45,Charlize Theron y dos compañeros de rodaje difíciles para trabajar https://t.co/SODiOLb6xn https://t.co/1sb68Ch42Q,http://www.twitter.com/LANACION/status/726457274311520256,12,5,1
La Nacion,2016-04-30 16:51:45,¿Por qué llegar tarde al trabajo puede ser lo mejor para todos? https://t.co/KpmtyQ66cN https://t.co/3KkfgjhqeX,http://www.twitter.com/LANACION/status/726454001877831680,31,19,2
La Nacion,2016-04-30 16:37:45,Es hija de un conocido conductor... ¿quién es? https://t.co/2hHSq8ZOw7 https://t.co/xrZsk0DRBJ,http://www.twitter.com/LANACION/status/726450477001498628,9,2,8
La Nacion,2016-04-30 16:26:45,El @Pontifex_es le alertó por carta a Nicolás Maduro de la situación en Venezuela https://t.co/ostnrsW5aR https://t.co/3Y1QWAfPRr,http://www.twitter.com/LANACION/status/726447708186284040,84,89,17
