Source,Date,Text,URL,Favorites,Retweets,Replies
ABC Color,2016-04-18 15:28:24,¿Cómo se financia la movilización? https://t.co/xVA4HA42rS https://t.co/duWiG8iEF7,http://www.twitter.com/abcdigital/status/722084371612741632,4,7,0
ABC Color,2016-04-18 15:16:09,[NOTA DE TAPA] Diputados aprueban elevar al Senado el juicio a Rousseff. https://t.co/JFQbx4q6vU https://t.co/X9LImVAgGV,http://www.twitter.com/abcdigital/status/722081287784251392,7,5,0
ABC Color,2016-04-18 15:11:26,#LoMásLeído: Futbolistas paraguayos se salvaron “de milagro”. https://t.co/wNkw1XCLTt https://t.co/zfJ3JXgRgd,http://www.twitter.com/abcdigital/status/722080099873484800,19,23,0
ABC Color,2016-04-18 14:57:37,Una nueva marcha en el centro de Asunción. https://t.co/va5KKH9zP5 https://t.co/Y5sAFk63WD,http://www.twitter.com/abcdigital/status/722076624150228992,8,8,2
ABC Color,2016-04-18 14:49:05,Transportistas también anuncian un paro parcial. https://t.co/kxYLDtMloH https://t.co/Bj2ok0VPJk,http://www.twitter.com/abcdigital/status/722074476486242304,11,14,0
ABC Color,2016-04-18 14:48:13,"RT @ABCCardinal: ""No estamos hablando de @Ferreiromario1 para el 2018"" Víctor ""Oti"" Sánchez,Director del Mercado de Abasto #730AM",http://www.twitter.com/abcdigital/status/722074256960581633,0,2,0
ABC Color,2016-04-18 13:14:40,Policía ordenó investigación en torno a la información falsa sobre supuesto golpe de Estado. https://t.co/kOMBefuHW6 https://t.co/cLLmbGy8Zu,http://www.twitter.com/abcdigital/status/722050717054287873,13,23,3
ABC Color,2016-04-18 13:01:21,Un violento asalto contra una adolescente en Asunción. https://t.co/0iwSlH91BB,http://www.twitter.com/abcdigital/status/722047365536968704,6,16,0
ABC Color,2016-04-18 12:50:42,Aseguran que protestas de cooperativistas y campesinos se desactivarán entre hoy y mañana. https://t.co/XZi4T0tSGq https://t.co/71HBiDLnGM,http://www.twitter.com/abcdigital/status/722044686588895232,14,6,3
ABC Color,2016-04-18 12:41:22,Dilma presentará 'batalla' ante el juicio político. https://t.co/JlACRa4vCm https://t.co/nT0iJgINvG,http://www.twitter.com/abcdigital/status/722042336444870656,6,15,0
ABC Color,2016-04-18 12:37:19,"#LoMásLeído: 4. Axl Rose es el nuevo cantante de AC/DC, vía @ABCEspectaculos. https://t.co/HbiXPipVdS https://t.co/6bKxKoPGhr",http://www.twitter.com/abcdigital/status/722041318403350529,20,43,0
ABC Color,2016-04-18 12:14:15,RT @ABCEspectaculos: ¡Empezá la semana con arte y cultura! Consultá nuestra #agenda: https://t.co/YPAZsj34Kh https://t.co/W0vrDP8Jrh,http://www.twitter.com/abcdigital/status/722035511947366401,0,2,0
ABC Color,2016-04-18 12:02:42,No se permitirán bloqueos de campesinos en San Pedro. https://t.co/sNYRods3xe https://t.co/k3WiY0Z5I3,http://www.twitter.com/abcdigital/status/722032604925530113,7,0,1
ABC Color,2016-04-18 11:58:46,#LoMásLeído: 5. Cae “pez gordo” del rollotráfico en Tavaí. https://t.co/43TsvXMmGH https://t.co/wWQeLPa3pn,http://www.twitter.com/abcdigital/status/722031616785256448,7,8,2
ABC Color,2016-04-18 11:55:31,RT @abcdeportes: Guaraní amarga el debut de Morínigo  https://t.co/oj4ksC3JRZ https://t.co/gH0fb0htjs,http://www.twitter.com/abcdigital/status/722030798224900097,0,27,2
ABC Color,2016-04-18 11:54:52,"RT @ABCCardinal: #Efemerides730 1955 Muere en EE.UU. el físico alemán Albert Einstein, creador de la teoría de la relatividad https://t.co/…",http://www.twitter.com/abcdigital/status/722030633111986176,0,34,1
ABC Color,2016-04-18 11:53:26,El supuesto pedido de indemnización es por un presunto abigeo muerto. https://t.co/2z1md7jJM1 https://t.co/2kQq5upuVT,http://www.twitter.com/abcdigital/status/722030272611512320,1,1,0
ABC Color,2016-04-18 11:46:12,Futbolistas paraguayos que fueron a Ecuador se salvaron de milagro. https://t.co/wNkw1XCLTt https://t.co/LUk0tX1OFQ,http://www.twitter.com/abcdigital/status/722028453424427008,23,29,1
ABC Color,2016-04-18 11:30:30,Ocurrió ayer: Condenaron a cuatro personas por narcotráfico. https://t.co/TnCU03jaPK https://t.co/BEAPHvuVhi,http://www.twitter.com/abcdigital/status/722024501932855296,4,1,0
ABC Color,2016-04-18 11:25:23,El calor se impondrá este lunes en todo el país. https://t.co/zM6b6TJl61 https://t.co/iz3iW3tjul,http://www.twitter.com/abcdigital/status/722023215720239104,7,6,0
ABC Color,2016-04-18 10:46:08,Titánica búsqueda de sobrevivientes del sismo en Ecuador. https://t.co/CVHzODxBd2 https://t.co/qN1ZweVPx3,http://www.twitter.com/abcdigital/status/722013337396060160,6,20,0
ABC Color,2016-04-18 10:36:20,Líderes de marcha campesina no pueden explicar cómo solventan la movilización. https://t.co/fDiI2MBOfn https://t.co/GbHnsTVsxM,http://www.twitter.com/abcdigital/status/722010871954804736,12,22,5
ABC Color,2016-04-18 10:14:16,Proseguirá este lunes la marcha campesina. https://t.co/yIrYVAIrQi https://t.co/74X2TBJbEu,http://www.twitter.com/abcdigital/status/722005316460744704,4,9,0
ABC Color,2016-04-18 05:53:10,Los pasos del impeachment  https://t.co/fVbI3pA0Ye https://t.co/iIb9dOZehS,http://www.twitter.com/abcdigital/status/721939609689657344,9,8,0
ABC Color,2016-04-18 05:43:51,Cuchillos requisados en cárceles van a un museo  https://t.co/GxBfKQcrDC https://t.co/PP7qZ67eaB,http://www.twitter.com/abcdigital/status/721937264985686016,5,7,0
ABC Color,2016-04-18 05:15:42,Funcionarios judiciales participarán de curso de actualización  https://t.co/je0birzD3W https://t.co/iVxlqshOau,http://www.twitter.com/abcdigital/status/721930178482606080,8,5,3
ABC Color,2016-04-18 04:05:20,Interior desmiente “acuartelamiento”  https://t.co/hGKwwnyIPo https://t.co/MkrH8DZDgO,http://www.twitter.com/abcdigital/status/721912473302011904,11,32,0
ABC Color,2016-04-18 02:59:20,Dilma va a juicio político  https://t.co/qy19smxwYE https://t.co/gC92t2SGOi,http://www.twitter.com/abcdigital/status/721895863002513408,39,59,1
ABC Color,2016-04-18 02:00:14,[MUNDO] Tensión en calles de Brasil  https://t.co/M7rb7EwDQ1 https://t.co/3WxBQmQuzR,http://www.twitter.com/abcdigital/status/721880989270740992,22,41,0
ABC Color,2016-04-18 01:26:40,Obispo Medina habilita capilla de Adoración Perpetua  https://t.co/yMKfsDufb9 https://t.co/8gjOq67fq4,http://www.twitter.com/abcdigital/status/721872542936481794,23,8,0
ABC Color,2016-04-18 00:11:00,[MUNDO] Dilma se aferra a la disidencia  https://t.co/iSAokVVBMr https://t.co/F32yjCKpAE,http://www.twitter.com/abcdigital/status/721853498330062849,11,23,1
ABC Color,2016-04-17 21:59:52,"Brasil, el gigante suramericano a la deriva. https://t.co/tg9Mh3UuZb https://t.co/4rIGMWDB5i",http://www.twitter.com/abcdigital/status/721820498217340931,22,38,0
ABC Color,2016-04-17 21:47:38,Condenan a un hombre por estafa en San Antonio. https://t.co/yr0Dcmb9nu,http://www.twitter.com/abcdigital/status/721817422102183937,4,1,0
ABC Color,2016-04-17 20:59:55,Brasil decide el destino de Rousseff en agitada sesión parlamentaria. https://t.co/T08DbhqFhU https://t.co/VC72MXagx7,http://www.twitter.com/abcdigital/status/721805414581596165,20,35,0
ABC Color,2016-04-17 20:57:15,Las FARC piden apoyo del papa Francisco.  https://t.co/2kqGGFmlXl https://t.co/bvKbrubfjI,http://www.twitter.com/abcdigital/status/721804741710323712,6,4,0
ABC Color,2016-04-17 20:35:24,"RT @ABCCardinal: Diez segundos para la historia, el voto del impeachment en Brasil https://t.co/I7885Gkp5w vía @abcdigital #730AM",http://www.twitter.com/abcdigital/status/721799242373836802,0,9,0
ABC Color,2016-04-17 20:30:38,Caminera detectó a 234 conductores ebrios. https://t.co/3ulWNi7P2x https://t.co/p8l3wfWvWC,http://www.twitter.com/abcdigital/status/721798044728078338,7,3,0
ABC Color,2016-04-17 20:11:25,España se solidariza con Ecuador. https://t.co/lTQY1HASq9 https://t.co/Naf5CqYitn,http://www.twitter.com/abcdigital/status/721793207395360769,5,6,0
ABC Color,2016-04-17 19:09:59,RT @abcdeportes: [CONTRATAPA] Nuevo Cerro en escena https://t.co/9pdEIWNJpT  Lee más de la edición impresa en https://t.co/jBjny1NXwf https…,http://www.twitter.com/abcdigital/status/721777747543126016,0,7,2
ABC Color,2016-04-17 18:51:22,"La cifra de fallecidos en Ecuador ascendió a 235, en tanto que la de heridos es de 1.557. https://t.co/N1qmCeVxG5 https://t.co/JqNhMxLSzC",http://www.twitter.com/abcdigital/status/721773062207746049,25,48,0
ABC Color,2016-04-17 18:48:07,"Y usted, ¿por quién vota? https://t.co/264QVI9qXJ https://t.co/g5jXvG7MJ3",http://www.twitter.com/abcdigital/status/721772244981194758,4,4,1
ABC Color,2016-04-17 18:24:07,"#LoMásLeído: Polémico triunfo decano, vía @abcdeportes. https://t.co/7Mq1Pguo7E",http://www.twitter.com/abcdigital/status/721766203929337856,8,6,14
ABC Color,2016-04-17 17:57:04,Habilitarán el tramo II de la avenida Ñu Guasu.  https://t.co/IlpmrIdflF https://t.co/mLLXFpbN49,http://www.twitter.com/abcdigital/status/721759398574571522,17,8,0
ABC Color,2016-04-17 17:51:19,El Arzobispo de Asunción pide “la paz pública en primer lugar”. https://t.co/WLBfcqj63M https://t.co/paMSKzR3Fq,http://www.twitter.com/abcdigital/status/721757949752971268,26,16,3
ABC Color,2016-04-17 17:34:13,"RT @ABCEspectaculos: 4 años atrás, @PaulMcCartney tocaba en Paraguay.  La crónica de @jorgecoronel y @kikesosa: https://t.co/Aj8irlQlgu htt…",http://www.twitter.com/abcdigital/status/721753646631940096,0,50,0
ABC Color,2016-04-17 17:19:05,"[ESPECIAL] ""Música para salvar el agua"", por @estefhycantie. https://t.co/lGudd6AnHM https://t.co/0iXR7R3RCB",http://www.twitter.com/abcdigital/status/721749837536980992,9,11,1
ABC Color,2016-04-17 17:18:20,Un fallecido tras el accidente en Liberación. https://t.co/Lg4ZXaUxmG https://t.co/KPpEVsbxIg,http://www.twitter.com/abcdigital/status/721749648063492097,1,5,0
ABC Color,2016-04-17 16:36:15,RT @ABCEspectaculos: Axl Rose es el nuevo cantante de AC/DC. https://t.co/cDT2QWXfgY https://t.co/ShFCgoTnyz,http://www.twitter.com/abcdigital/status/721739057714348034,0,166,11
ABC Color,2016-04-17 15:53:56,#TerremotoEnEcuador Embajadora paraguaya en Ecuador habla sobre compatriotas tras el sismo   https://t.co/HnO2ezkeCO https://t.co/dGqJ2KeNMh,http://www.twitter.com/abcdigital/status/721728407445356545,13,25,1
ABC Color,2016-04-17 15:50:57,#TerremotoEnEcuador Se triplica la cantidad de muertos en Ecuador por sismo   https://t.co/uqXy0nALnv https://t.co/u7N5VPI9Cz,http://www.twitter.com/abcdigital/status/721727658766311424,7,22,0
ABC Color,2016-04-17 15:08:26,Pobladores del Chaco hacen lo que no podía @mopcparaguay  https://t.co/bkfNQQG6xt https://t.co/sWlykZ1rc5,http://www.twitter.com/abcdigital/status/721716958119530502,11,22,5
ABC Color,2016-04-17 13:58:45,Presidente @Horacio_Cartes se solidariza con pueblo ecuatoriano tras terremoto https://t.co/v9PUxH5SGl https://t.co/1WzxvV69GJ,http://www.twitter.com/abcdigital/status/721699421579292672,19,13,0
ABC Color,2016-04-17 13:23:31,Once matrimonios vip del TSJE se llevan G. 4.180 millones en un año https://t.co/zd1cuM5z3O https://t.co/xkBpsscKe4,http://www.twitter.com/abcdigital/status/721690556175380484,20,82,8
ABC Color,2016-04-17 12:29:54,Número de fallecido por terremoto en Ecuador ya asciende a 77 https://t.co/m1PJsXn9Nn https://t.co/eomqfpWfQf,http://www.twitter.com/abcdigital/status/721677060582830081,17,23,0
ABC Color,2016-04-17 12:08:02,Máximas superarían los 40° C este domingo https://t.co/M6Sxma6AQ0 https://t.co/WYn2BKq5nl,http://www.twitter.com/abcdigital/status/721671557614018560,5,23,1
ABC Color,2016-04-17 05:37:24,Ya son 41 los muertos en el terremoto de #Ecuador https://t.co/7muePhgCFx,http://www.twitter.com/abcdigital/status/721573252880011264,7,23,0
ABC Color,2016-04-17 03:08:18,Paraguaya en Ecuador relata lo vivido durante terremoto https://t.co/lNd6BeTZNS,http://www.twitter.com/abcdigital/status/721535731731197952,24,27,0
ABC Color,2016-04-17 01:53:40,"RT @ABCEspectaculos: Alejandro Sanz: “Paraguay enamora” (I), por @jorgecoronel y @monica_bareiro p/ @ABCCardinal. https://t.co/Izp2swv55m h…",http://www.twitter.com/abcdigital/status/721516950166368257,0,46,2
ABC Color,2016-04-17 01:50:41,Alerta de tsunami en costas de todo el Pacífico tras fuerte sismo en Ecuador https://t.co/UcL9AIqhqk,http://www.twitter.com/abcdigital/status/721516197544648704,21,48,2
ABC Color,2016-04-17 01:09:06,Fuerte sismo en Ecuador cerca de la frontera con Colombia https://t.co/sjSV2AR9cX,http://www.twitter.com/abcdigital/status/721505732496121856,16,34,2
ABC Color,2016-04-16 21:20:15,"""Merecés que te reviente la cara""  https://t.co/HblBfxk06F https://t.co/VvwUPztA1w",http://www.twitter.com/abcdigital/status/721448143217434624,25,44,4
ABC Color,2016-04-16 19:19:40,Arte paraguayo en Nueva York  https://t.co/FwhFiW8GiY https://t.co/IM6bqnN2zD,http://www.twitter.com/abcdigital/status/721417797440565249,25,7,0
ABC Color,2016-04-16 18:22:54,[TECNOLOGÍA] Advierten sobre nuevo engaño vía WhatsApp   https://t.co/613DIOi3xb https://t.co/HIbN3NFnW1,http://www.twitter.com/abcdigital/status/721403509862723584,12,30,2
ABC Color,2016-04-16 18:16:27,#LoMásLeído  Renunció Morínigo   https://t.co/AS83sWP9eN https://t.co/egPobaYEsn,http://www.twitter.com/abcdigital/status/721401885014552576,2,9,3
ABC Color,2016-04-16 17:53:57,Un año y seis meses sin Pablo Medina  https://t.co/5yhMLxCSs4 https://t.co/6Q5scClFGq,http://www.twitter.com/abcdigital/status/721396223106772994,3,13,0
ABC Color,2016-04-16 17:51:08,Autorizaron destrucción de un esteral en Caazapá   https://t.co/vYmV87gUrI https://t.co/bt0D7hVlf1,http://www.twitter.com/abcdigital/status/721395515087265792,4,15,1
ABC Color,2016-04-16 17:44:36,Incautan combustible en Pilar   https://t.co/JkBPujKCgY https://t.co/1Z15AIcWlS,http://www.twitter.com/abcdigital/status/721393873155567616,6,7,0
ABC Color,2016-04-16 16:35:43,"RT @ElPalco730: ¡Hoy entrevistamos a @AlejandroSanz y regalamos entradas! Desde las 14:00, con @jorgecoronel, @mapontepy y @kikesosa https:…",http://www.twitter.com/abcdigital/status/721376537203908608,0,20,5
ABC Color,2016-04-16 16:17:48,Más de 100.000 campesinos morosos   https://t.co/zM8rcjLPqY https://t.co/1CV5vVzeCT,http://www.twitter.com/abcdigital/status/721372028603863040,3,10,1
ABC Color,2016-04-16 15:14:59,Juicio político: Rousseff apura negociaciones   https://t.co/qllJRTmush https://t.co/SlPRaEGe8L,http://www.twitter.com/abcdigital/status/721356220381208577,6,4,1
ABC Color,2016-04-16 15:03:00,"Tras semanas de caos vehicular, bloquean nuevamente calles del centro   https://t.co/lw52eaCVJ5 https://t.co/mQSYOj6Ptp",http://www.twitter.com/abcdigital/status/721353204445876224,8,5,1
ABC Color,2016-04-16 14:55:20,El Papa rescata a 12 refugiados sirios y se los lleva en su avión  https://t.co/GnLIqPjIzo https://t.co/4VIvBIMijp,http://www.twitter.com/abcdigital/status/721351273757437957,82,97,11
ABC Color,2016-04-16 14:47:07,Cierres en Eusebio Ayala por trabajos de Essap  https://t.co/n7gjMAcSV6 https://t.co/7DotLPqxie,http://www.twitter.com/abcdigital/status/721349207349706752,3,8,1
ABC Color,2016-04-16 12:51:19,[CLIMA] Anuncian más de 40° C de sensación térmica https://t.co/hC8bIhkd7L https://t.co/Yiqxl2rvPI,http://www.twitter.com/abcdigital/status/721320063219998720,6,12,1
ABC Color,2016-04-16 08:40:00,"[ESPECIAL] ""Reinserción, clave contra el hacinamiento"", por @orliespinoza  https://t.co/7pMKSj89vJ https://t.co/SnUHMBdZkh",http://www.twitter.com/abcdigital/status/721256820602454018,5,2,10
ABC Color,2016-04-16 08:21:31,"[ESPECIAL] ""Música para salvar el agua"", por @estefhycantie https://t.co/lGudd6AnHM https://t.co/lwARbqBv2Y",http://www.twitter.com/abcdigital/status/721252169106726912,9,6,3
ABC Color,2016-04-16 08:05:12,"Violencia contra periodistas crece, dice Unesco  https://t.co/NuivtYT2t6 https://t.co/kiB0kbka0g",http://www.twitter.com/abcdigital/status/721248059699642368,5,5,0
ABC Color,2016-04-16 07:50:33,"[ESPECIAL] ""US$ 1 millón a cambio de US$ 55 millones"" https://t.co/s6NW4hDv9D, por @alesilva_89 https://t.co/F9cjOLCyOU",http://www.twitter.com/abcdigital/status/721244371958542336,4,4,1
ABC Color,2016-04-16 06:22:08,"[ESPECIAL] ""¿Qué frena la maternidad?"" https://t.co/wvm7eW9pae, por @FlaBorja https://t.co/weCpRXywnl",http://www.twitter.com/abcdigital/status/721222121448480768,2,1,0
ABC Color,2016-04-16 05:18:45,Entre los peores de la región  https://t.co/sYtdIl7zvZ https://t.co/onC8B5fTaH,http://www.twitter.com/abcdigital/status/721206171336642560,12,19,0
ABC Color,2016-04-16 04:46:30,"Paraguay, el mayor exportador de mandioca en Sudamérica  https://t.co/VMlAxjZ54P https://t.co/7jgT9lZyhe",http://www.twitter.com/abcdigital/status/721198056633450496,47,46,0
ABC Color,2016-04-16 04:08:12,[VIDEO] Cuatro fallecidos por tornado en Uruguay  https://t.co/vz7xwlf9i6 https://t.co/jabbgttd8u,http://www.twitter.com/abcdigital/status/721188416101212160,22,55,4
ABC Color,2016-04-16 01:42:04,[ACTUALIZACIÓN] Acribillan a policía en Pedro Juan Caballero https://t.co/gTxHCNxcZA https://t.co/TWVorkKcKc,http://www.twitter.com/abcdigital/status/721151642276663296,5,10,0
ABC Color,2016-04-16 01:36:39,Fatal accidente en San Ignacio involucró a gerente de canal de televisión  https://t.co/nPXgRsEpsw https://t.co/YjMgATTNPP,http://www.twitter.com/abcdigital/status/721150278465150977,15,33,1
ABC Color,2016-04-16 01:24:03,Acribillan a efectivo policial en Pedro Juan Caballero https://t.co/gTxHCNxcZA NOTICIA EN DESARROLLO https://t.co/oPXsq6xHL8,http://www.twitter.com/abcdigital/status/721147107827195904,7,9,0
ABC Color,2016-04-16 00:56:18,Tornado deja al menos dos muertos al oeste de Uruguay   https://t.co/yjIpSaF0aI https://t.co/o4s2NbcK90,http://www.twitter.com/abcdigital/status/721140123656654849,23,31,0
ABC Color,2016-04-16 00:37:31,Despiden a profesora en Chile por amordazar a escolar de cinco años https://t.co/2J7tGAjIqz https://t.co/r6iQLASy72,http://www.twitter.com/abcdigital/status/721135396697088000,9,11,0
ABC Color,2016-04-16 00:16:25,Campesinos dicen que ya no aceptarán mediadores   https://t.co/3orBYZMUoK https://t.co/CVUmzLi0Vc,http://www.twitter.com/abcdigital/status/721130089128280064,5,4,3
ABC Color,2016-04-16 00:04:04,Secretario de la ONU se solidariza con Paraguay por inundaciones  https://t.co/ZwYtGOvbCG https://t.co/2GrgymnAm0,http://www.twitter.com/abcdigital/status/721126980897357825,10,7,2
ABC Color,2016-04-15 23:18:33,Tigre ataca y mata a empleada de zoológico en Estados Unidos  https://t.co/p4SRlMna6c https://t.co/e8Vp7tlTl4,http://www.twitter.com/abcdigital/status/721115524978110465,12,7,1
ABC Color,2016-04-15 22:58:00,Hallan panfleto en lugar de tiroteo   https://t.co/T7LBA3KMSj https://t.co/pBunu5W9kd,http://www.twitter.com/abcdigital/status/721110353631973376,4,1,0
ABC Color,2016-04-15 22:43:26,Trabajador casi muere electrocutado   https://t.co/BFHZ0AKoxn https://t.co/9lD1RnoWcK,http://www.twitter.com/abcdigital/status/721106689613787136,5,2,0
ABC Color,2016-04-15 22:04:30,#LoMásLeído  “No le hice nada a nadie”   https://t.co/6QZxiGdopr https://t.co/bUL21QgttR,http://www.twitter.com/abcdigital/status/721096891128221697,9,12,3
ABC Color,2016-04-15 21:21:12,A D'Ecclesiis “le avergüenza” no tener pista de aterrizaje  https://t.co/oKUpiqI45z https://t.co/Wb7gQCsvlt,http://www.twitter.com/abcdigital/status/721085993923829761,5,5,1
ABC Color,2016-04-15 21:09:56,"Hay votos suficientes para juicio a Dilma, dice Folha   https://t.co/c8zVPNB3rJ https://t.co/08R6AB1mbR",http://www.twitter.com/abcdigital/status/721083158691753985,5,8,0
ABC Color,2016-04-15 20:25:03,Senador González Daher volverá al Jurado de Enjuiciamiento  https://t.co/N93bdSJMGx https://t.co/694dZlcRIL,http://www.twitter.com/abcdigital/status/721071860411207681,12,5,1
ABC Color,2016-04-15 19:51:44,"[TECNOLOGÍA] La “diosa”Jia Jia, el primer robot interactivo de China. https://t.co/JsViFCqhVA https://t.co/SgOmo8cJ6T",http://www.twitter.com/abcdigital/status/721063476500762625,14,19,0
ABC Color,2016-04-15 19:36:34,El domingo se habilitaría un carril en la Autopista. https://t.co/4rNAJDFbdG https://t.co/fafMs7afxK,http://www.twitter.com/abcdigital/status/721059662167216129,5,5,0
ABC Color,2016-04-15 19:31:37,Habrían matado a un abogado vinculado a caso de corrupción en Argentina. https://t.co/kCdPeGHqiE https://t.co/9VAibGHJl6,http://www.twitter.com/abcdigital/status/721058416060428289,1,5,0
ABC Color,2016-04-15 19:16:17,El nefasto prontuario de Amado Benítez. https://t.co/mYMrsk6g3N https://t.co/bVqMwXl5R7,http://www.twitter.com/abcdigital/status/721054555442712576,2,7,0
ABC Color,2016-04-15 19:05:21,La oposición venezolana convoca a un censo para organizar referendo presidencial. https://t.co/V5bSJvIPHz https://t.co/w9GwyhPBD1,http://www.twitter.com/abcdigital/status/721051803559817217,3,1,0
ABC Color,2016-04-15 18:44:40,#LoMásLeído: Farías deja Cerro. https://t.co/6OgZ5UqC1T https://t.co/srGwFNap0D,http://www.twitter.com/abcdigital/status/721046599091240960,11,1,1
ABC Color,2016-04-15 18:36:25,Campesinos anuncian que endurecerán medidas de fuerza y retornarán a las calles el lunes. https://t.co/ewemcqnJ5O https://t.co/6NiaMVfr77,http://www.twitter.com/abcdigital/status/721044523871244288,10,25,10
ABC Color,2016-04-15 18:08:15,La UIP rechaza la intención del Congreso de declarar nuevo día feriado. https://t.co/D6KRF2VsEF https://t.co/y63GTriIJk,http://www.twitter.com/abcdigital/status/721037435728240641,8,9,11
ABC Color,2016-04-15 17:38:41,La condonación de la deuda de campesinos “no es viable” para el Gobierno. https://t.co/JE37IK87cI https://t.co/CpMcGYK6XF,http://www.twitter.com/abcdigital/status/721029994592473088,13,14,4
ABC Color,2016-04-15 17:34:18,"El scrio. de presidencia Juan Carlos López Moreira dice que condonación de las deudas no es viable, vía @ABCCardinal https://t.co/nwu6d4DU8W",http://www.twitter.com/abcdigital/status/721028891243110404,27,28,0
ABC Color,2016-04-15 17:17:38,Mario Abdo Benítez instó a la pacificación a todos los sectores. https://t.co/4LumAhXaTL https://t.co/5bhvTJONAm,http://www.twitter.com/abcdigital/status/721024695978561536,7,5,1
ABC Color,2016-04-15 17:12:17,Mató a su hermano y lo arrojó a un pozo. https://t.co/W86MRtmW2L https://t.co/jBGoRdC1BP,http://www.twitter.com/abcdigital/status/721023349200187394,8,4,0
ABC Color,2016-04-15 16:02:42,[HUMOR] Algunos magistrados dejaron parte de sus vestuarios para ingresar a la Cumbre... 👀 https://t.co/HUSBiA8QGf https://t.co/t0trfqy8ox,http://www.twitter.com/abcdigital/status/721005837934817281,22,13,0
ABC Color,2016-04-15 15:51:27,El “más buscado” cayó sin ningún disparo. https://t.co/ntJp4FDRoG https://t.co/k5fmK7yL2k,http://www.twitter.com/abcdigital/status/721003008922882049,2,4,0
ABC Color,2016-04-15 15:51:27,El “más buscado” cayó sin ningún disparo. https://t.co/ntJp4FDRoG https://t.co/k5fmK7yL2k,http://www.twitter.com/abcdigital/status/721003008922882049,2,4,0
ABC Color,2016-04-15 15:43:31,Investigan el ataque de anoche en Horqueta. https://t.co/uOdTRFAG57 https://t.co/5fCvENvbTi,http://www.twitter.com/abcdigital/status/721001012585185280,4,1,0
ABC Color,2016-04-15 15:36:45,Un barrabrava de Cerro agredió a un hombre en Sajonia. https://t.co/tug7eQ6sAa,http://www.twitter.com/abcdigital/status/720999309240639489,2,5,0
ABC Color,2016-04-15 15:23:08,Principio de incendio en la caja central del IPS. https://t.co/3JcRIXYYbY https://t.co/TsisXVv0p0,http://www.twitter.com/abcdigital/status/720995880648720384,3,7,0
ABC Color,2016-04-15 15:20:22,Un susto en IPS por un principio de incendio. https://t.co/3JcRIXYYbY https://t.co/IV5kWRyvWA,http://www.twitter.com/abcdigital/status/720995187049242624,4,6,0
ABC Color,2016-04-15 15:16:36,#LoMásLeído: 3. Salvan a una beba paraguaya en Argentina. https://t.co/L7u3FRVsmf https://t.co/GqDVYP1ACA,http://www.twitter.com/abcdigital/status/720994238796795904,23,14,0
ABC Color,2016-04-15 15:06:30,Un incendio consume una humilde vivienda en Carapeguá. https://t.co/nfJekuVqch https://t.co/ou9Spw7jyL,http://www.twitter.com/abcdigital/status/720991694947278849,2,2,0
ABC Color,2016-04-15 15:02:14,Un ministro español renuncia a raíz de los #PanamaPapers. https://t.co/w6Ml5iR99V https://t.co/vHlhFueyPE,http://www.twitter.com/abcdigital/status/720990623189311492,0,1,0
ABC Color,2016-04-15 14:53:31,"RT @ABCEspectaculos: [CINE] Se estrenan hoy en Paraguay ""Avenida Cloverfield 10"" y ""Norm y los Invencibles"". https://t.co/t3AQvJQs1G https:…",http://www.twitter.com/abcdigital/status/720988428188454912,0,6,0
ABC Color,2016-04-15 14:51:52,"RT @ABCCardinal: ""Si un comunicador comunitario sufre violencia, debe recibir la misma cobertura que la de un periodista de un diario famos…",http://www.twitter.com/abcdigital/status/720988014449684481,0,7,1
ABC Color,2016-04-15 14:50:27,RT @abcdeportes: El cierre es una ventaja  https://t.co/CsRVwLE8Rq https://t.co/Ioh0c8KbbG,http://www.twitter.com/abcdigital/status/720987657929637888,0,3,1
ABC Color,2016-04-15 14:47:46,"[ESPECIAL] ""Superación verde olivo"", por @SaintOscar. https://t.co/Duo4GMxlSz https://t.co/rF0PSPBqYZ",http://www.twitter.com/abcdigital/status/720986981392654337,6,3,1
ABC Color,2016-04-15 13:54:28,Llaman a asegurados de IPS a movilizarse contra intención de aumentar la edad de jubilación. https://t.co/A6bdOmBlST https://t.co/QzMZ1LRqFW,http://www.twitter.com/abcdigital/status/720973569400913921,19,30,1
ABC Color,2016-04-15 13:44:20,La defensa de Rousseff denuncia un “golpe” y pide anular juicio. https://t.co/HYqKgmkhsV https://t.co/2eAgJSvQsu,http://www.twitter.com/abcdigital/status/720971017947123712,4,4,1
ABC Color,2016-04-15 13:35:52,"[ESPECIAL] ""Jorge Ratti, 'casi parido'"", por @jorgecoronel. https://t.co/xz8gCXqQly https://t.co/rt7XafOUkS",http://www.twitter.com/abcdigital/status/720968890038231040,13,4,1
ABC Color,2016-04-15 13:31:47,Insisten en la condonación a los 71 mil productores. https://t.co/3eZi18UwP6 https://t.co/guQgRSWqCb,http://www.twitter.com/abcdigital/status/720967861745934336,3,6,9
